<?xml version="1.0" encoding="UTF-8"?>
<?xml-stylesheet type="text/xsl" href="agenda.xsl"?>
<agenda xmlns:xsi="http://www.w3.org/2001/XMLSchema-instance"
        xsi:noNamespaceSchemaLocation="agenda.xsd">

    <!-- Contacto 1 -->
    <contacto nombre="Emilia" apellido="Rosas" fechaNacimiento="1995-08-21" nickname="EmR" grupo="Amigos">
        <telefono tipo="movil">5551234567</telefono>
        <telefono tipo="casa">559876543</telefono>
        <correo tipo="personal">emi.ros@mail.com</correo>
        <correo tipo="trabajo">emi.ros@empresa.com</correo>
        <direccion>
            <calle>Av. Reforma 123</calle>
            <ciudad>Ciudad de México</ciudad>
            <estado>CDMX</estado>
            <codigoPostal>01234</codigoPostal>
            <pais>México</pais>
        </direccion>
    </contacto>

    <!-- Contacto 2 -->
    <contacto nombre="Carlos" apellido="Ramírez" fechaNacimiento="2001-02-15" grupo="Trabajo">
        <telefono tipo="trabajo">551122334</telefono>
        <correo tipo="trabajo">carlos.ramirez@empresa.com</correo>
        <direccion>
            <calle>Calle del Sol 45</calle>
            <ciudad>Guadalajara</ciudad>
            <estado>Jalisco</estado>
            <codigoPostal>44100</codigoPostal>
            <pais>México</pais>
        </direccion>
    </contacto>

    <!-- Contacto 3 -->
    <contacto nombre="María" apellido="González" nickname="MG" grupo="Familia">
        <telefono tipo="movil">5559876543</telefono>
        <correo tipo="personal">maria.gonzalez@mail.com</correo>
    </contacto>

    <!-- Contacto 4 -->
    <contacto nombre="Juan" apellido="Hernández" fechaNacimiento="2008-11-30" grupo="Amigos">
        <telefono tipo="movil">5552345678</telefono>
        <correo tipo="personal">juan.hernandez@mail.com</correo>
        <direccion>
            <calle>Av. Insurgentes 456</calle>
            <ciudad>Ciudad de México</ciudad>
            <estado>CDMX</estado>
            <codigoPostal>01010</codigoPostal>
            <pais>México</pais>
        </direccion>
    </contacto>

    <!-- Contacto 5 -->
    <contacto nombre="Ana" apellido="Martínez" grupo="Trabajo">
        <telefono tipo="trabajo">553344556</telefono>
        <correo tipo="trabajo">ana.martinez@empresa.com</correo>
    </contacto>

    <!-- Contacto 6 -->
    <contacto nombre="Luis" apellido="Torres" fechaNacimiento="1992-07-10" grupo="Familia">
        <telefono tipo="movil">5553456789</telefono>
        <correo tipo="personal">luis.torres@mail.com</correo>
        <direccion>
            <calle>Calle Luna 789</calle>
            <ciudad>Monterrey</ciudad>
            <estado>Nuevo León</estado>
            <codigoPostal>64000</codigoPostal>
            <pais>México</pais>
        </direccion>
    </contacto>

    <!-- Contacto 7 -->
    <contacto nombre="Sofía" apellido="Vargas" nickname="SofiV" grupo="Amigos">
        <telefono tipo="movil">5554567890</telefono>
        <correo tipo="personal">sofia.vargas@mail.com</correo>
    </contacto>

</agenda>